<?xml version="1.0" encoding="UTF-8"?>
<!-- edited with XML Spy v4.3 U (http://www.xmlspy.com) by Randy Regnier (SIL International) -->
<GAFAWSData xmlns:xsi="http://www.w3.org/2001/XMLSchema-instance" xsi:noNamespaceSchemaLocation=".\GAFAWS.xsd">
  <WordRecords>
	<WordRecord WRID="WR1">
	  <Prefixes>
		<Affix MIDREF="p4"/>
		<Affix MIDREF="p3"/>
	  </Prefixes>
	  <Stem MIDREF="R"/>
	  <Suffixes>
		<Affix MIDREF="s3"/>
		<Affix MIDREF="s4"/>
	  </Suffixes>
	  <Other>
		<clientWordStuff/>
	  </Other>
	</WordRecord>
	<WordRecord WRID="WR2">
	  <Prefixes>
		<Affix MIDREF="p3"/>
		<Affix MIDREF="p2"/>
	  </Prefixes>
	  <Stem MIDREF="R"/>
	  <Suffixes>
		<Affix MIDREF="s2"/>
		<Affix MIDREF="s3"/>
	  </Suffixes>
	</WordRecord>
	<WordRecord WRID="WR3">
	  <Prefixes>
		<Affix MIDREF="p4"/>
		<Affix MIDREF="p1"/>
	  </Prefixes>
	  <Stem MIDREF="R"/>
	  <Suffixes>
		<Affix MIDREF="s1"/>
		<Affix MIDREF="s4"/>
	  </Suffixes>
	</WordRecord>
	<WordRecord WRID="WR4">
	  <Prefixes>
		<Affix MIDREF="p2"/>
		<Affix MIDREF="p1"/>
	  </Prefixes>
	  <Stem MIDREF="R"/>
	  <Suffixes>
		<Affix MIDREF="s1"/>
		<Affix MIDREF="s2"/>
	  </Suffixes>
	</WordRecord>
	<WordRecord WRID="WR5">
	  <Prefixes>
		<Affix MIDREF="p4"/>
		<Affix MIDREF="p23"/>
		<Affix MIDREF="p1"/>
	  </Prefixes>
	  <Stem MIDREF="R"/>
	  <Suffixes>
		<Affix MIDREF="s1"/>
		<Affix MIDREF="s23"/>
		<Affix MIDREF="s4"/>
	  </Suffixes>
	</WordRecord>
	<WordRecord WRID="WR6">
	  <Prefixes>
		<Affix MIDREF="p34"/>
		<Affix MIDREF="p12"/>
	  </Prefixes>
	  <Stem MIDREF="R"/>
	  <Suffixes>
		<Affix MIDREF="s12"/>
		<Affix MIDREF="s34"/>
	  </Suffixes>
	</WordRecord>
	<WordRecord WRID="WR7">
	  <Prefixes>
		<Affix MIDREF="p3"/>
		<Affix MIDREF="p12"/>
	  </Prefixes>
	  <Stem MIDREF="R"/>
	  <Suffixes>
		<Affix MIDREF="s12"/>
		<Affix MIDREF="s3"/>
	  </Suffixes>
	</WordRecord>
	<WordRecord WRID="WR8">
	  <Prefixes>
		<Affix MIDREF="p34"/>
		<Affix MIDREF="p2"/>
	  </Prefixes>
	  <Stem MIDREF="R"/>
	  <Suffixes>
		<Affix MIDREF="s2"/>
		<Affix MIDREF="s34"/>
	  </Suffixes>
	</WordRecord>
	<WordRecord WRID="WR9">
	  <Prefixes>
		<Affix MIDREF="p4"/>
		<Affix MIDREF="p13"/>
	  </Prefixes>
	  <Stem MIDREF="R"/>
	  <Suffixes>
		<Affix MIDREF="s13"/>
		<Affix MIDREF="s4"/>
	  </Suffixes>
	</WordRecord>
	<WordRecord WRID="WR10">
	  <Prefixes>
		<Affix MIDREF="p24"/>
		<Affix MIDREF="p1"/>
	  </Prefixes>
	  <Stem MIDREF="R"/>
	  <Suffixes>
		<Affix MIDREF="s1"/>
		<Affix MIDREF="s24"/>
	  </Suffixes>
	</WordRecord>
	<WordRecord WRID="WR11">
	  <Prefixes>
		<Affix MIDREF="p14"/>
	  </Prefixes>
	  <Stem MIDREF="R"/>
	  <Suffixes>
		<Affix MIDREF="s14"/>
	  </Suffixes>
	</WordRecord>
	<WordRecord WRID="WR12">
	  <Prefixes>
		<Affix MIDREF="p2"/>
		<Affix MIDREF="p3"/>
		<Affix MIDREF="p1"/>
	  </Prefixes>
	  <Stem MIDREF="R"/>
	  <Suffixes>
		<Affix MIDREF="s1"/>
		<Affix MIDREF="s3"/>
		<Affix MIDREF="s2"/>
	  </Suffixes>
	</WordRecord>
  </WordRecords>
  <Morphemes>
	<Morpheme MID="R" type="s">
	  <Other>
		<clientMorphemeStuff/>
	  </Other>
	</Morpheme>
	<Morpheme MID="p1" type="pfx" StartCLIDREF="PP1" EndCLIDREF="PP0"/>
	<Morpheme MID="p2" type="pfx" StartCLIDREF="PP0" EndCLIDREF="PP0"/>
	<Morpheme MID="p3" type="pfx" StartCLIDREF="PP0" EndCLIDREF="PP0"/>
	<Morpheme MID="p4" type="pfx" StartCLIDREF="PP0" EndCLIDREF="PP4"/>
	<Morpheme MID="p12" type="pfx" StartCLIDREF="PP1" EndCLIDREF="PP0"/>
	<Morpheme MID="p13" type="pfx" StartCLIDREF="PP1" EndCLIDREF="PP3"/>
	<Morpheme MID="p14" type="pfx" StartCLIDREF="PP1" EndCLIDREF="PP4"/>
	<Morpheme MID="p23" type="pfx" StartCLIDREF="PP2" EndCLIDREF="PP3"/>
	<Morpheme MID="p24" type="pfx" StartCLIDREF="PP2" EndCLIDREF="PP4"/>
	<Morpheme MID="p34" type="pfx" StartCLIDREF="PP0" EndCLIDREF="PP4"/>
	<Morpheme MID="s1" type="sfx" StartCLIDREF="SP1" EndCLIDREF="SP0"/>
	<Morpheme MID="s2" type="sfx" StartCLIDREF="SP0" EndCLIDREF="SP0"/>
	<Morpheme MID="s3" type="sfx" StartCLIDREF="SP0" EndCLIDREF="SP0"/>
	<Morpheme MID="s4" type="sfx" StartCLIDREF="SP0" EndCLIDREF="SP4"/>
	<Morpheme MID="s12" type="sfx" StartCLIDREF="SP1" EndCLIDREF="SP0"/>
	<Morpheme MID="s13" type="sfx" StartCLIDREF="SP1" EndCLIDREF="SP3"/>
	<Morpheme MID="s14" type="sfx" StartCLIDREF="SP1" EndCLIDREF="SP4"/>
	<Morpheme MID="s23" type="sfx" StartCLIDREF="SP2" EndCLIDREF="SP3"/>
	<Morpheme MID="s24" type="sfx" StartCLIDREF="SP2" EndCLIDREF="SP4"/>
	<Morpheme MID="s34" type="sfx" StartCLIDREF="SP0" EndCLIDREF="SP4"/>
  </Morphemes>
  <Classes>
	<PrefixClasses>
	  <Class CLID="PP1"/>
	  <Class CLID="PP2"/>
	  <Class CLID="PP0" isFogBank="1"/>
	  <Class CLID="PP3"/>
	  <Class CLID="PP4"/>
	</PrefixClasses>
	<SuffixClasses>
	  <Class CLID="SP1"/>
	  <Class CLID="SP2"/>
	  <Class CLID="SP0" isFogBank="1"/>
	  <Class CLID="SP3"/>
	  <Class CLID="SP4"/>
	</SuffixClasses>
  </Classes>
  <Challenges>
	<Challenge message="Prefix data is inconsistent." code="0"/>
	<Challenge message="Suffix data is inconsistent." code="0"/>
  </Challenges>
</GAFAWSData>
