<?xml version="1.0" encoding="utf-8"?>
<GAFAWSData xmlns:xsi="http://www.w3.org/2001/XMLSchema-instance" xsi:noNamespaceSchemaLocation=".\GAFAWS.xsd" date="Friday, October 03, 2003" time="9:48:33 PM">
  <WordRecords>
	<WordRecord id="WR1">
	  <Prefixes>
		<Affix id="p4" />
		<Affix id="p3" />
	  </Prefixes>
	  <Stem MIDREF="R" />
	  <Suffixes>
		<Affix id="s2" />
	  </Suffixes>
	  <Other>
		<XmlElements />
	  </Other>
	</WordRecord>
	<WordRecord id="WR2">
	  <Prefixes>
		<Affix id="p3" />
		<Affix id="p2" />
	  </Prefixes>
	  <Stem id="R" />
	  <Suffixes>
		<Affix id="s1" />
	  </Suffixes>
	</WordRecord>
	<WordRecord id="WR3">
	  <Prefixes>
		<Affix id="p4" />
		<Affix id="p1" />
	  </Prefixes>
	  <Stem id="R" />
	  <Suffixes>
		<Affix id="s1" />
		<Affix id="s2" />
	  </Suffixes>
	</WordRecord>
	<WordRecord id="WR4">
	  <Prefixes>
		<Affix id="p2" />
		<Affix id="p1" />
	  </Prefixes>
	  <Stem id="R" />
	  <Suffixes>
		<Affix id="s2" />
		<Affix id="s3" />
	  </Suffixes>
	</WordRecord>
	<WordRecord id="WR5">
	  <Prefixes>
		<Affix id="p4" />
		<Affix id="p23" />
		<Affix MIDREF="p1" />
	  </Prefixes>
	  <Stem MIDREF="R" />
	  <Suffixes>
		<Affix id="s12" />
		<Affix id="s3" />
	  </Suffixes>
	</WordRecord>
	<WordRecord id="WR6">
	  <Prefixes>
		<Affix id="p34" />
		<Affix id="p12" />
	  </Prefixes>
	  <Stem id="R" />
	  <Suffixes>
		<Affix id="s1" />
		<Affix id="s23" />
	  </Suffixes>
	</WordRecord>
	<WordRecord id="WR7">
	  <Prefixes>
		<Affix id="p3" />
		<Affix MIDREF="p12" />
	  </Prefixes>
	  <Stem id="R" />
	</WordRecord>
	<WordRecord id="WR8">
	  <Prefixes>
		<Affix id="p34" />
		<Affix id="p2" />
	  </Prefixes>
	  <Stem id="R" />
	</WordRecord>
	<WordRecord id="WR9">
	  <Prefixes>
		<Affix id="p4" />
		<Affix id="p13" />
	  </Prefixes>
	  <Stem id="R" />
	  <Suffixes>
		<Affix id="s13" />
	  </Suffixes>
	</WordRecord>
	<WordRecord id="WR10">
	  <Prefixes>
		<Affix id="p24" />
		<Affix id="p1" />
	  </Prefixes>
	  <Stem id="R" />
	</WordRecord>
	<WordRecord id="WR11">
	  <Prefixes>
		<Affix id="p14" />
	  </Prefixes>
	  <Stem id="R" />
	</WordRecord>
  </WordRecords>
  <Morphemes>
	<Morpheme id="R" type="s">
	  <Other>
		<XmlElements />
	  </Other>
	</Morpheme>
	<Morpheme id="p1" startclass="PP1" endclass="PP1" type="pfx" />
	<Morpheme id="p2" startclass="PP2" endclass="PP2" type="pfx" />
	<Morpheme id="p3" startclass="PP3" endclass="PP3" type="pfx" />
	<Morpheme id="p4" startclass="PP4" endclass="PP4" type="pfx" />
	<Morpheme id="p12" startclass="PP1" endclass="PP2" type="pfx" />
	<Morpheme id="p13" startclass="PP1" endclass="PP3" type="pfx" />
	<Morpheme id="p14" startclass="PP1" endclass="PP4" type="pfx" />
	<Morpheme id="p23" startclass="PP2" endclass="PP3" type="pfx" />
	<Morpheme id="p24" startclass="PP2" endclass="PP4" type="pfx" />
	<Morpheme id="p34" startclass="PP3" endclass="PP4" type="pfx" />
	<Morpheme id="s1" startclass="SP1" endclass="SP1" type="sfx" />
	<Morpheme id="s2" startclass="SP2" endclass="SP2" type="sfx" />
	<Morpheme id="s3" startclass="SP3" endclass="SP3" type="sfx" />
	<Morpheme id="s12" startclass="SP1" endclass="SP2" type="sfx" />
	<Morpheme id="s13" startclass="SP1" endclass="SP3" type="sfx" />
	<Morpheme id="s23" startclass="SP2" endclass="SP3" type="sfx" />
  </Morphemes>
	<AffixSets>
		<AffixCooccurrences />
		<AffixNonCooccurrences />
		<DistinctSets />
	</AffixSets>
	<SubgraphSets />
  <Classes>
	<PrefixClasses>
	  <Class id="PP1" />
	  <Class id="PP2" />
	  <Class id="PP3" />
	  <Class id="PP4" />
	</PrefixClasses>
	<SuffixClasses>
	  <Class id="SP1" />
	  <Class id="SP2" />
	  <Class id="SP3" />
	</SuffixClasses>
  </Classes>
  <Challenges />
</GAFAWSData>