<?xml version="1.0" encoding="UTF-8"?>
<!-- edited with XML Spy v4.3 U (http://www.xmlspy.com) by Randy Regnier (SIL International) -->
<GAFAWSData xmlns:xsi="http://www.w3.org/2001/XMLSchema-instance" xsi:noNamespaceSchemaLocation=".\GAFAWS.xsd">
  <WordRecords>
	<WordRecord id="WR1">
	  <Prefixes>
		<Affix id="p4"/>
		<Affix id="p3"/>
	  </Prefixes>
	  <Stem id="R"/>
	  <Suffixes>
		<Affix id="s2"/>
	  </Suffixes>
	  <Other>
		<clientWordStuff/>
	  </Other>
	</WordRecord>
	<WordRecord id="WR2">
	  <Prefixes>
		<Affix id="p3"/>
		<Affix id="p2"/>
	  </Prefixes>
	  <Stem id="R"/>
	  <Suffixes>
		<Affix id="s1"/>
	  </Suffixes>
	</WordRecord>
	<WordRecord id="WR3">
	  <Prefixes>
		<Affix id="p4"/>
		<Affix id="p1"/>
	  </Prefixes>
	  <Stem id="R"/>
	  <Suffixes>
		<Affix id="s1"/>
		<Affix id="s2"/>
	  </Suffixes>
	</WordRecord>
	<WordRecord id="WR4">
	  <Prefixes>
		<Affix id="p2"/>
		<Affix id="p1"/>
	  </Prefixes>
	  <Stem id="R"/>
	  <Suffixes>
		<Affix id="s2"/>
		<Affix id="s3"/>
	  </Suffixes>
	</WordRecord>
	<WordRecord id="WR5">
	  <Prefixes>
		<Affix id="p4"/>
		<Affix id="p23"/>
		<Affix id="p1"/>
	  </Prefixes>
	  <Stem id="R"/>
	  <Suffixes>
		<Affix id="s12"/>
		<Affix id="s3"/>
	  </Suffixes>
	</WordRecord>
	<WordRecord id="WR6">
	  <Prefixes>
		<Affix id="p34"/>
		<Affix id="p12"/>
	  </Prefixes>
	  <Stem id="R"/>
	  <Suffixes>
		<Affix id="s1"/>
		<Affix id="s23"/>
	  </Suffixes>
	</WordRecord>
	<WordRecord id="WR7">
	  <Prefixes>
		<Affix id="p3"/>
		<Affix id="p12"/>
	  </Prefixes>
	  <Stem id="R"/>
	</WordRecord>
	<WordRecord id="WR8">
	  <Prefixes>
		<Affix id="p34"/>
		<Affix id="p2"/>
	  </Prefixes>
	  <Stem id="R"/>
	</WordRecord>
	<WordRecord id="WR9">
	  <Prefixes>
		<Affix id="p4"/>
		<Affix id="p13"/>
	  </Prefixes>
	  <Stem id="R"/>
	  <Suffixes>
		<Affix id="s13"/>
	  </Suffixes>
	</WordRecord>
	<WordRecord id="WR10">
	  <Prefixes>
		<Affix id="p24"/>
		<Affix id="p1"/>
	  </Prefixes>
	  <Stem id="R"/>
	</WordRecord>
	<WordRecord id="WR11">
	  <Prefixes>
		<Affix id="p14"/>
	  </Prefixes>
	  <Stem id="R"/>
	</WordRecord>
  </WordRecords>
  <Morphemes>
	<Morpheme id="R" type="s">
	  <Other>
		<clientMorphemeStuff/>
	  </Other>
	</Morpheme>
	<Morpheme id="p1" type="pfx"/>
	<Morpheme id="p2" type="pfx"/>
	<Morpheme id="p3" type="pfx"/>
	<Morpheme id="p4" type="pfx"/>
	<Morpheme id="p12" type="pfx"/>
	<Morpheme id="p13" type="pfx"/>
	<Morpheme id="p14" type="pfx"/>
	<Morpheme id="p23" type="pfx"/>
	<Morpheme id="p24" type="pfx"/>
	<Morpheme id="p34" type="pfx"/>
	<Morpheme id="s1" type="sfx"/>
	<Morpheme id="s2" type="sfx"/>
	<Morpheme id="s3" type="sfx"/>
	<Morpheme id="s12" type="sfx"/>
	<Morpheme id="s13" type="sfx"/>
	<Morpheme id="s23" type="sfx"/>
  </Morphemes>
	<AffixCooccurrences />
	<AffixNonCooccurrences />
	<DistinctSets />
  <Classes>
	<PrefixClasses/>
	<SuffixClasses/>
  </Classes>
  <Challenges/>
</GAFAWSData>
